<?xml version="1.0" encoding="UTF-8"?>
<xsd:schema xmlns:xsd="http://www.w3.org/2001/XMLSchema" 
    
    xmlns:epers="http://agid.it/suap/entities/persona"
    
    xmlns:vpergen="http://agid.it/suap/vocabularies/persona_genere"
    xmlns:ccodelist="http://agid.it/suap/commons/codelist"      
    xmlns:canncl="http://agid.it/suap/commons/xsdAnnotations" 
    xmlns:ctipi="http://agid.it/suap/commons/tipi"
    
    targetNamespace="http://agid.it/suap/entities/persona"
    elementFormDefault="qualified" attributeFormDefault="qualified"    
    version="1.0.0" xml:lang="it">
      
    <xsd:import namespace="http://agid.it/suap/commons/xsdAnnotations" schemaLocation="../commons-xsd-annotations.xsd"/>    
    <xsd:import namespace="http://agid.it/suap/commons/codelist" schemaLocation="../commons-codelist.xsd"/>
    <xsd:import namespace="http://agid.it/suap/commons/tipi" schemaLocation="../commons-tipi.xsd"/> 
    <xsd:import namespace="http://agid.it/suap/vocabularies/persona_genere" schemaLocation="../01_vocabularies/voc_persona_genere_v1.0.0.xsd"/>
    
    <xsd:complexType name="persona_ctype">
        <xsd:sequence>
            <xsd:element name="codice_fiscale" type="ctipi:codice_fiscale_stype" minOccurs="1" maxOccurs="1"/>
            <xsd:element name="nome" type="ctipi:stringa_standard_stype" minOccurs="1" maxOccurs="1"/>
            <xsd:element name="cognome" type="ctipi:stringa_standard_stype" minOccurs="1" maxOccurs="1"/>
            <xsd:element name="sesso" type="vpergen:sesso_voc" minOccurs="0" maxOccurs="1"/>            
            <xsd:element name="data_nascita" type="xsd:date" minOccurs="0" maxOccurs="1"/>
            <xsd:choice minOccurs="0" maxOccurs="1">
                <xsd:element name="luogo_nascita_italiano" type="ccodelist:CodeType" minOccurs="1" maxOccurs="1" >
                    <xsd:annotation>
                        <xsd:appinfo>                        
                            <canncl:codeListReference>
                                <canncl:ShortName>IT:SUAP:CL:ComuniItalianiStorico</canncl:ShortName>
                            </canncl:codeListReference>                        
                        </xsd:appinfo>                    
                    </xsd:annotation>                    
                </xsd:element>                                   
                <xsd:element name="stato_estero" type="ccodelist:CodeType" minOccurs="1" maxOccurs="1" >
                    <xsd:annotation>
                        <xsd:appinfo>                        
                            <canncl:codeListReference>
                                <canncl:ShortName>IT:SUAP:CL:Stati</canncl:ShortName>
                            </canncl:codeListReference>                        
                        </xsd:appinfo>                    
                    </xsd:annotation>
                </xsd:element>                    
            </xsd:choice>
       </xsd:sequence>        
    </xsd:complexType>          
    
    <xsd:element name="persona" type="epers:persona_ctype"/>    
</xsd:schema>
