<?xml version="1.0" encoding="UTF-8"?>
<ep:persona xmlns:vpg="http://vocabolari/persona_genere"
 xmlns:ep="http://entita/persona"
 xmlns:cl="http://agid.it/suap/commons/codelist"
 xmlns:ca="http://agid.it/suap/commons/xsdAnnotations"
 xmlns:ct="http://agid.it/suap/commons/tipi"
 xmlns:xsi="http://www.w3.org/2001/XMLSchema-instance"
 xsi:schemaLocation="http://entita/persona file:/F:/softwareDEV/GIT/repos/suap-gt-specifiche/to_moduli/moduli_fvg/02_entita/ent_persona_v1.0.0.xsd">
    <ep:codice_fiscale>AAAAAA00A00A000A</ep:codice_fiscale>
    <ep:nome>nome0</ep:nome>
    <ep:cognome>cognome0</ep:cognome>
    <ep:sesso>maschio</ep:sesso>
    <ep:data_nascita>2006-05-04</ep:data_nascita>
<!--    <ep:luogo_nascita_italiano cl:codeListID_cl="codeListID_cl0" cl:name_cl="name_cl0" cl:versionID_cl="versionID_cl0">luogo_nascita_italiano0</ep:luogo_nascita_italiano>-->
    <ep:luogo_nascita_estero>luogo_nascita_estero0</ep:luogo_nascita_estero>
    <ep:stato_estero cl:codeListID_cl="codeListID_cl1" cl:name_cl="name_cl1" cl:versionID_cl="versionID_cl1">stato_estero0</ep:stato_estero>
</ep:persona>
